{
  "events_version": "1.0.0",
  "tracks": [
    { "track_id": "t1", "role": "guitar", "name": "Guitar" }
  ],
  "beats": [
    { "t": 0.0, "bar": 0, "beat": 0, "strength": 1.0 }
  ],
  "sections": [
    { "t0": 0.0, "t1": 4.0, "label": "intro" }
  ],
  "notes": [],
  "onsets": [],
  "pitch_contours": [],
  "chords": []
}
